{
  "content_id": "tchp-16-pos-61-i-pos-40-raznica",
  "schema_version": "1.1",
  "title": "ПОС-61 и ПОС-40: в чём разница и что выбрать",
  "slug": "pos-61-i-pos-40-raznica",
  "excerpt": "# ПОС-61 и ПОС-40: в чём разница и что выбрать",
  "category_slug": "materialy",
  "tags": [
    "Материалы / Припои",
    "пайка"
  ],
  "reading_time": 5,
  "difficulty": "Практик",
  "solder_alloy": "universal",
  "temp_data": {
    "kind": "station_setpoint",
    "range": "270 – 300 °C"
  },
  "tools": [
    {
      "name": "Оловоотсос",
      "model": "",
      "purpose": "Пайка и демонтаж"
    },
    {
      "name": "Оплётка",
      "model": "",
      "purpose": "Пайка и демонтаж"
    }
  ],
  "content_html": "<h1>ПОС-61 и ПОС-40: в чём разница и что выбрать</h1>\n\n<p>Число в названии припоя показывает процент олова, и больше оно ничего не обещает. Реальная разница в том, как сплав остывает: у ПОС-61 между «жидкий» и «твёрдый» всего 7 °C, а у ПОС-40 целых 55 °C. Пока припой проходит этот интервал, шов выглядит застывшим, но ещё подвижен.</p>\n\n<h2>Краткий ответ</h2>\n\n<p>ПОС-61 содержит 61 % олова и 39 % свинца, плавится с 183 °C и становится полностью жидким при 190 °C. ПОС-40 содержит 40 % олова и 60 % свинца, начинает плавиться при тех же 183 °C, но полностью жидким становится только при 238 °C.</p>\n\n<p>Для плат, SMD и тонких выводов берите ПОС-61. ПОС-40 оставьте для проводов, лужения и крупных деталей, где шов никто не двигает.</p>\n\n<h2>Что означают цифры</h2>\n\n<p>Нижняя граница плавления называется солидус, верхняя — ликвидус. Между ними сплав состоит из твёрдых кристаллов и жидкости одновременно.</p>\n\n<p>| Параметр | ПОС-61 | ПОС-40 |\n|---|---|---|\n| Олово / свинец | 61 % / 39 % | 40 % / 60 % |\n| Солидус | 183 °C | 183 °C |\n| Ликвидус | 190 °C | 238 °C |\n| Интервал | 7 °C | 55 °C |\n| Типичное применение | радиоаппаратура, платы | лужение и пайка проводов, латунь, оцинкованные детали |</p>\n\n<p>Данные по маркам приведены по ГОСТ 21930-76 и 21931-76 в справочных таблицах. [web:64][web:65]</p>\n\n<p>Одна оговорка. Строго эвтектическим, то есть плавящимся при одной температуре, считается ПОС-63. ПОС-61 к нему очень близок, но интервал в 7 °C у него есть. [web:64] Поэтому «мгновенно» в применении к ПОС-61 означает «почти сразу», а не «без промежуточной стадии».</p>\n\n<h2>Почему это важно при пайке</h2>\n\n<p>Пока температура шва находится между ликвидусом и солидусом, внутри уже растут твёрдые кристаллы, а между ними ещё есть жидкость. Если деталь в этот момент сдвинуть, кристаллы разорвут связи, и шов получится матовым и зернистым.</p>\n\n<p>У ПОС-61 это окно узкое, у ПОС-40 широкое. Отсюда и главный практический вывод: с ПОС-40 деталь нужно держать неподвижно дольше. На массивной детали, которая медленно остывает, окно растягивается ещё сильнее.</p>\n\n<h2>Какую температуру выставлять</h2>\n\n<p>В техническом задании проекта указаны ориентиры по уставке станции: 270–300 °C для ПОС-61 и 310–340 °C для ПОС-40. Это уставка станции, а не температура шва, и зависит она от жала, массы детали и станции. Начинайте с нижней границы и поднимайте, если припой вязкий и не растекается.</p>\n\n<p>Показатель правильного режима: припой растекается по площадке и образует гладкий блестящий шов, а не шарик.</p>\n\n<h2>Когда какой припой брать</h2>\n\n<p>1. Платы, SMD и тонкие выводы — ПОС-61. Нагрев нужен короткий, и шов не должен долго оставаться подвижным.\n2. Толстые провода, клеммы, радиаторы — подойдёт ПОС-40, если деталь надёжно зафиксирована.\n3. Не уверены — берите ПОС-61. Универсальнее, и его проще довести до хорошего шва.</p>\n\n<h2>Частые ошибки</h2>\n\n<p>- **Двигать деталь, пока шов остывает.** С ПОС-40 это даёт матовый зернистый шов. Зафиксируйте деталь и ждите, пока всё затвердеет.\n- **Греть ПОС-40 как ПОС-61.** Припой вязкий и плохо растекается. Поднимите уставку, но не держите жало дольше необходимого.\n- **Паять плату ПОС-40 на высокой уставке.** Текстолит не любит долгого тепла, и дорожка может отойти.\n- **Брать катушку без маркировки.** Состав неизвестен, режим подобрать нельзя.</p>\n\n<h2>Безопасность</h2>\n\n<p>В ПОС-40 свинца 60 %, в ПОС-61 — 39 %. Паяйте с вытяжкой или хотя бы при проветривании, мойте руки после работы и не ешьте за рабочим местом. Дым флюса не вдыхайте.</p>\n\n<h2>FAQ</h2>\n\n<p>**Можно ли паять плату припоем ПОС-40?**\nМожно, но шов проще испортить: пока припой не затвердел полностью, любое смещение деталей даёт матовый шов. Для плат лучше ПОС-61 (подробнее о характеристиках сплавов читайте в обзоре [виды припоев для пайки](/pripoj-dlya-pajki-vidy)).</p>\n\n<p>**Почему ПОС-40 дешевле?**\nВ нём меньше олова, а олово дороже свинца.</p>\n\n<p>**Чем эвтектический припой отличается от обычного?**\nУ эвтектики солидус и ликвидус совпадают, поэтому промежуточной зоны нет. ПОС-63 эвтектический, ПОС-61 очень близок к нему. Особенности работы с тугоплавкими составами рассмотрены в статье [бессвинцовый припой](/bessvincovyj-pripoj).</p>\n\n<p>**Можно ли смешивать ПОС-61 и ПОС-40?**\nЛучше не стоит: температура затвердевания смеси станет промежуточной. Старый припой перед доработкой лучше убрать оплёткой или помпой (а для прецизионного монтажа SMD рассмотреть [паяльную пасту или припой в проволоке](/payalnaya-pasta-ili-pripoj)).</p>\n\n<h2>Нормативная база</h2>\n\n<p>- **ГОСТ 21930-76** — Припои оловянно-свинцовые в чушках. Технические условия (химический состав, нормы содержания сурьмы, висмута и меди).\n- **ГОСТ 21931-76** — Припои оловянно-свинцовые в виде проволоки, прутков и трубок с наполнителем из канифоли.\n- **ISO 9453:2020** — Soft solder alloys — Chemical compositions and forms (международные требования к оловянным сплавам).</p>",
  "faq": [
    {
      "q": "Можно ли паять плату припоем ПОС-40?",
      "a": "Можно, но шов проще испортить: пока припой не затвердел полностью, любое смещение деталей даёт матовый шов. Для плат лучше ПОС-61 (подробнее о характеристиках сплавов читайте в обзоре [виды припоев для пайки](/pripoj-dlya-pajki-vidy))."
    },
    {
      "q": "Почему ПОС-40 дешевле?",
      "a": "В нём меньше олова, а олово дороже свинца."
    },
    {
      "q": "Чем эвтектический припой отличается от обычного?",
      "a": "У эвтектики солидус и ликвидус совпадают, поэтому промежуточной зоны нет. ПОС-63 эвтектический, ПОС-61 очень близок к нему. Особенности работы с тугоплавкими составами рассмотрены в статье [бессвинцовый припой](/bessvincovyj-pripoj)."
    },
    {
      "q": "Можно ли смешивать ПОС-61 и ПОС-40?",
      "a": "Лучше не стоит: температура затвердевания смеси станет промежуточной. Старый припой перед доработкой лучше убрать оплёткой или помпой (а для прецизионного монтажа SMD рассмотреть [паяльную пасту или припой в проволоке](/payalnaya-pasta-ili-pripoj))."
    }
  ],
  "sources": [
    {
      "title": "ГОСТ 21930-76 — Припои оловянно-свинцовые в чушках. Технические условия (химический состав, нормы содержания сурьмы, висмута и меди",
      "standard": "ГОСТ 21930-76"
    },
    {
      "title": "ГОСТ 21931-76 — Припои оловянно-свинцовые в виде проволоки, прутков и трубок с наполнителем из канифоли",
      "standard": "ГОСТ 21931-76"
    },
    {
      "title": "ISO 9453:2020 — Soft solder alloys — Chemical compositions and forms (международные требования к оловянным сплавам",
      "standard": "ISO 9453"
    }
  ]
}