{
  "content_id": "tchp-17-bessvincovyj-pripoj",
  "schema_version": "1.1",
  "title": "Бессвинцовый припой: плюсы, минусы, когда использовать",
  "slug": "bessvincovyj-pripoj",
  "excerpt": "# Бессвинцовый припой: плюсы, минусы, когда использовать",
  "category_slug": "materialy",
  "tags": [
    "Материалы / Припои",
    "пайка"
  ],
  "reading_time": 5,
  "difficulty": "Практик",
  "solder_alloy": "sac305",
  "temp_data": {
    "kind": "station_setpoint",
    "range": "217 – 220 °C"
  },
  "tools": [
    {
      "name": "Паяльник",
      "model": "",
      "purpose": "Пайка и демонтаж"
    },
    {
      "name": "Оловоотсос",
      "model": "",
      "purpose": "Пайка и демонтаж"
    },
    {
      "name": "Оплётка",
      "model": "",
      "purpose": "Пайка и демонтаж"
    }
  ],
  "content_html": "<h1>Бессвинцовый припой: плюсы, минусы, когда использовать</h1>\n\n<p>Бессвинцовый припой не лучше и не хуже оловянно-свинцового. Это другой материал с другими условиями: он плавится выше, хуже смачивает поверхность и требует более горячей работы. Зато в современной электронике он стал стандартом.</p>\n\n<h2>Краткий ответ</h2>\n\n<p>Самый распространённый бессвинцовый сплав — SAC305: 96,5 % олова, 3 % серебра, 0,5 % меди. Он плавится при 217–220 °C, то есть на 30–40 °C выше, чем ПОС-61. [web:60][web:63] Из-за этого он требует более высокой уставки станции и аккуратной работы с флюсом.</p>\n\n<p>**Что делать:**</p>\n\n<p>1. Проверьте, под какой припой сделана Ваша плата, и по возможности паяйте тем же типом.\n2. Поднимите уставку станции: для SAC305 в справочных материалах называют 320–350 °C. [web:69]\n3. Используйте достаточно активный флюс: смачиваемость у бессвинцовых сплавов хуже. [web:63]\n4. Не смешивайте на одном шве бессвинцовый и оловянно-свинцовый припой.\n5. Если сомневаетесь, сначала потренируйтесь на ненужной плате.</p>\n\n<h2>Чем отличается от ПОС-61</h2>\n\n<p>| Параметр | ПОС-61 | SAC305 |\n|---|---|---|\n| Состав | 61 % олова, 39 % свинца | 96,5 % олова, 3 % серебра, 0,5 % меди |\n| Температура плавления | 183–190 °C | 217–220 °C |\n| Смачиваемость | лучше | хуже |\n| Свинец | есть | нет |</p>\n\n<p>По данным справочных таблиц. [web:63][web:60]</p>\n\n<h2>Плюсы</h2>\n\n<p>- **Нет свинца.** Это снижает вред для здоровья и позволяет соответствовать требованиям RoHS. [web:69]\n- **Сплав подходит для современной электроники.** Его используют в смартфонах, компьютерах и бытовой технике. [web:69]\n- **Лучшая электропроводность.** По справочным данным, бессвинцовые припои обладают более высокой электропроводностью. [web:63]</p>\n\n<h2>Минусы</h2>\n\n<p>- **Более высокая температура.** Выше нагрев, значит больше риск перегреть плату и компоненты.\n- **Хуже смачивает.** Припой растекается менее охотно, поэтому флюс и чистота поверхности важнее.\n- **Шов выглядит иначе.** Бессвинцовый шов часто бывает менее блестящим, и новичок легко принимает это за дефект. Блеск как единственный критерий качества здесь работает хуже.</p>\n\n<h2>Когда использовать</h2>\n\n<p>- Вы паяете новые платы, сделанные под бессвинцовый процесс.\n- Вы делаете устройство, к которому предъявляются требования по свинцу. Конкретные требования для Вашего случая лучше уточнить отдельно.\n- Вам нужна безсвинцовая альтернатива из соображений здоровья и экологии.</p>\n\n<p>Оловянно-свинцовый припой остаётся удобным вариантом для ремонта старой техники и для тех, кто хочет паять при более низкой температуре.</p>\n\n<h2>Частые ошибки</h2>\n\n<p>- **Паять SAC305 на уставке для ПОС-61.** Припой вязкий и не растекается. Поднимайте температуру ступенчато.\n- **Греть плату слишком долго.** Высокая уставка плюс долгий контакт греют текстолит сильнее.\n- **Смешивать припои.** Температура затвердевания получится промежуточной и непредсказуемой.\n- **Экономить на флюсе.** С бессвинцовым сплавом он нужен больше, чем с ПОС.</p>\n\n<h2>Безопасность</h2>\n\n<p>Отсутствие свинца не делает пайку безопасной во всём остальном: дым флюса вредно вдыхать, горячий припой обжигает, брызги летят в глаза. Нужна вытяжка или проветривание, защита глаз и аккуратность с жалом.</p>\n\n<h2>FAQ</h2>\n\n<p>**Бессвинцовый припой безопаснее?**\nВ нём нет свинца, но дым флюса и ожоги остаются. Вытяжка нужна в любом случае.</p>\n\n<p>**Можно ли паять бессвинцовым припоем обычным паяльником?**\nМожно, если он выдерживает нужную температуру и держит её под нагрузкой. Для сравнения температурных режимов смотрите [сравнение ПОС-61 и ПОС-40](/pos-61-i-pos-40-raznica).</p>\n\n<p>**Почему шов получается тусклым?**\nДля бессвинцовых сплавов это нормально. Оценивайте шов по растеканию и по тому, как припой смочил площадку и вывод, а не только по блеску (классификация составов детально описана в руководстве [виды припоев для пайки](/pripoj-dlya-pajki-vidy)).</p>\n\n<p>**Можно ли добавлять бессвинцовый припой к старому оловянно-свинцовому шву?**\nЛучше убрать старый припой оплёткой или помпой и пропаять заново, чем смешивать составы (для ответственного монтажа микросхем удобнее [паяльная паста или припой в проволоке](/payalnaya-pasta-ili-pripoj)).</p>\n\n<h2>Нормативная база</h2>\n\n<p>- **IPC J-STD-006C** — Requirements for Electronic Grade Solder Alloys and Fluxed/Non-Fluxed Solid Solders for Electronic Soldering Applications (стандарт сплавов SAC305).\n- **IPC J-STD-004B** — Requirements for Soldering Fluxes (требования к флюсам для высокотемпературной бессвинцовой пайки).\n- **ISO 9453:2020** — Soft solder alloys — Chemical compositions and forms (составы бессвинцовых эвтектик и псевдоэвтектик).</p>",
  "faq": [
    {
      "q": "Бессвинцовый припой безопаснее?",
      "a": "В нём нет свинца, но дым флюса и ожоги остаются. Вытяжка нужна в любом случае."
    },
    {
      "q": "Можно ли паять бессвинцовым припоем обычным паяльником?",
      "a": "Можно, если он выдерживает нужную температуру и держит её под нагрузкой. Для сравнения температурных режимов смотрите [сравнение ПОС-61 и ПОС-40](/pos-61-i-pos-40-raznica)."
    },
    {
      "q": "Почему шов получается тусклым?",
      "a": "Для бессвинцовых сплавов это нормально. Оценивайте шов по растеканию и по тому, как припой смочил площадку и вывод, а не только по блеску (классификация составов детально описана в руководстве [виды припоев для пайки](/pripoj-dlya-pajki-vidy))."
    },
    {
      "q": "Можно ли добавлять бессвинцовый припой к старому оловянно-свинцовому шву?",
      "a": "Лучше убрать старый припой оплёткой или помпой и пропаять заново, чем смешивать составы (для ответственного монтажа микросхем удобнее [паяльная паста или припой в проволоке](/payalnaya-pasta-ili-pripoj))."
    }
  ],
  "sources": [
    {
      "title": "IPC J-STD-006C — Requirements for Electronic Grade Solder Alloys and Fluxed/Non-Fluxed Solid Solders for Electronic Soldering Applications (стандарт с",
      "standard": "IPC J-STD-006C"
    },
    {
      "title": "IPC J-STD-004B — Requirements for Soldering Fluxes (требования к флюсам для высокотемпературной бессвинцовой пайки",
      "standard": "IPC J-STD-004B"
    },
    {
      "title": "ISO 9453:2020 — Soft solder alloys — Chemical compositions and forms (составы бессвинцовых эвтектик и псевдоэвтектик",
      "standard": "ISO 9453"
    }
  ]
}