{
  "content_id": "tchp-52-payalnaya-pasta-ili-pripoj",
  "schema_version": "1.1",
  "title": "Паяльная паста или припой в проволоке: что выбрать и в чём разница",
  "slug": "payalnaya-pasta-ili-pripoj",
  "excerpt": "# Паяльная паста или припой в проволоке: что выбрать и в чём разница",
  "category_slug": "materialy",
  "tags": [
    "Паяльные пасты и химия",
    "пайка"
  ],
  "reading_time": 5,
  "difficulty": "Практик",
  "solder_alloy": "universal",
  "temp_data": {
    "kind": "station_setpoint",
    "range": "210 – 230 °C"
  },
  "tools": [
    {
      "name": "Паяльник",
      "model": "",
      "purpose": "Пайка и демонтаж"
    },
    {
      "name": "Термофен",
      "model": "",
      "purpose": "Пайка и демонтаж"
    }
  ],
  "content_html": "<h1>Паяльная паста или припой в проволоке: что выбрать и в чём разница</h1>\n\n<p>Паяльная паста и проволочный припой делают одно дело, но устроены по-разному. Проволока — это металл, который подаёт жало. Паста — это порошок припоя вместе с флюсом, который сначала наносят на площадки, а потом оплавляют.</p>\n\n<h2>Краткий ответ</h2>\n\n<p>Для обычной ручной пайки проводов и выводов берите проволочный припой и отдельный флюс. Паяльная паста нужна для монтажа SMD-компонентов методом оплавления. [web:70]</p>\n\n<p>**Что делать:**</p>\n\n<p>1. Определите задачу: провод и выводы — проволока, SMD с оплавлением — паста.\n2. Если паяете мелкие SMD вручную в небольшом объёме, проволока плюс жидкий флюс часто удобнее. [web:70]\n3. Для пасты нужен способ нагрева всей зоны: фен, плита или печь.\n4. Проверьте состав пасты: сплав должен подходить к Вашим платам.\n5. Не используйте пасту как замену флюса для обычной пайки проводов.</p>\n\n<h2>Из чего состоят</h2>\n\n<p>Паста — это однородная масса из порошка припоя и флюса-связки. [web:71] Обычно она также содержит добавки, которые помогают ей держать форму. [web:70]</p>\n\n<p>Проволочный припой — чистый металлический сплав, а флюс в нём может быть только в виде сердцевины. [web:70] Если в проволоке нет флюса, его добавляют отдельно.</p>\n\n<h2>Сравнение</h2>\n\n<p>| Параметр | Паяльная паста | Припой в проволоке |\n|---|---|---|\n| Состав | порошок припоя + флюс | металлический сплав, иногда с флюсом внутри |\n| Как наносят | шприцем, дозатором, через трафарет | подают жалом паяльника |\n| Нагрев | оплавление всей зоны термофеном или в печи | локальный нагрев жалом |\n| Температурный режим | пик оплавления 210–230 °C (для оловянно-свинцовых) или 240–250 °C (SAC305) | рабочая уставка жала 280–320 °C для ПОС-61 |\n| Где применяют | SMD, BGA, серийный монтаж | ручная пайка, ремонт, провода |\n| Объём работы | много однотипных площадок | единичные и разнородные швы |</p>\n\n<p>Принцип деления взят из справочных материалов. [web:70][web:61]</p>\n\n<h2>Когда брать пасту</h2>\n\n<p>- Вы монтируете много SMD-компонентов на одной плате.\n- Вам нужна одинаковая доза припоя на каждой площадке.\n- У Вас есть способ равномерно прогреть плату.\n- Вы занимаетесь реболлингом или сборкой плат с нуля. [web:61]</p>\n\n<h2>Когда брать проволоку</h2>\n\n<p>- Вы паяете провода, выводы, разъёмы.\n- Вы ремонтируете отдельные узлы.\n- Вам нужно точечно перепаять одну деталь.\n- Вы паяете немного SMD вручную: проволока с жидким флюсом даёт больше контроля. [web:70]</p>\n\n<h2>Частые ошибки</h2>\n\n<p>- **Использовать пасту для пайки провода.** Паста рассчитана на оплавление, а не на подачу жалом.\n- **Нанести слишком много пасты.** Лишний припой при оплавлении собирается в шарики и мосты.\n- **Греть пасту только жалом.** Без равномерного прогрева шов будет холодным.\n- **Забыть про флюс при работе с проволокой без сердцевины.** Припой не смочит поверхность.</p>\n\n<h2>Безопасность</h2>\n\n<p>И паста, и флюс выделяют дым при нагреве: нужна вытяжка или проветривание. Если сплав свинцовый, соблюдайте гигиену: мойте руки и не ешьте за рабочим столом. Паяйте в защитных очках.</p>\n\n<h2>FAQ</h2>\n\n<p>**Можно ли заменить пасту проволокой?**\nДля отдельных SMD вручную можно: проволока с жидким флюсом даёт контроль. Для серийной сборки паста удобнее (сравнение составов смотрите в обзоре [виды припоев для пайки](/pripoj-dlya-pajki-vidy)).</p>\n\n<p>**Паяльная паста заменяет флюс?**\nНет, в пасте флюс уже есть, но это не отменяет флюс для других операций. Для бессвинцовых составов типа SAC305 требования к флюсу гораздо выше — подробности в статье [бессвинцовый припой](/bessvincovyj-pripoj).</p>\n\n<p>**Подходит ли паста для обычного паяльника?**\nПаста рассчитана на оплавление всей зоны, поэтому нужен фен, плита или печь. Жалом её можно использовать, но результат менее предсказуем (критерии выбора инструмента описаны в гиде [какой паяльник выбрать для дома](/kakoj-payalnik-vybrat)).</p>\n\n<p>**Можно ли смешивать пасту и проволоку?**\nЛучше не стоит, если сплавы разные: температуры плавления и свойства могут не совпасть. Классические различия температур показаны в материале [сравнение ПОС-61 и ПОС-40](/pos-61-i-pos-40-raznica).</p>\n\n<h2>Нормативная база</h2>\n\n<p>- **IPC J-STD-005 Rev. B** — Requirements for Solder Pastes (стандарт технических требований к паяльным пастам, типам дисперсности порошка Type 3/4 и флюсовым связующим).\n- **IPC-7530** — Guidelines for Temperature Profiling for Mass Soldering Processes (руководство по контролю температурных профилей оплавления).\n- **ГОСТ 21931-76** — Припои оловянно-свинцовые в виде проволоки и трубок с канифольным сердечником.</p>",
  "faq": [
    {
      "q": "Можно ли заменить пасту проволокой?",
      "a": "Для отдельных SMD вручную можно: проволока с жидким флюсом даёт контроль. Для серийной сборки паста удобнее (сравнение составов смотрите в обзоре [виды припоев для пайки](/pripoj-dlya-pajki-vidy))."
    },
    {
      "q": "Паяльная паста заменяет флюс?",
      "a": "Нет, в пасте флюс уже есть, но это не отменяет флюс для других операций. Для бессвинцовых составов типа SAC305 требования к флюсу гораздо выше — подробности в статье [бессвинцовый припой](/bessvincovyj-pripoj)."
    },
    {
      "q": "Подходит ли паста для обычного паяльника?",
      "a": "Паста рассчитана на оплавление всей зоны, поэтому нужен фен, плита или печь. Жалом её можно использовать, но результат менее предсказуем (критерии выбора инструмента описаны в гиде [какой паяльник выбрать для дома](/kakoj-payalnik-vybrat))."
    },
    {
      "q": "Можно ли смешивать пасту и проволоку?",
      "a": "Лучше не стоит, если сплавы разные: температуры плавления и свойства могут не совпасть. Классические различия температур показаны в материале [сравнение ПОС-61 и ПОС-40](/pos-61-i-pos-40-raznica)."
    }
  ],
  "sources": [
    {
      "title": "IPC J-STD-005 Rev. B — Requirements for Solder Pastes (стандарт технических требований к паяльным пастам, типам дисперсности порошка Type 3/4 и флюсов",
      "standard": "IPC J-STD-005 Rev"
    },
    {
      "title": "IPC-7530 — Guidelines for Temperature Profiling for Mass Soldering Processes (руководство по контролю температурных профилей оплавления",
      "standard": "IPC-7530"
    },
    {
      "title": "ГОСТ 21931-76 — Припои оловянно-свинцовые в виде проволоки и трубок с канифольным сердечником",
      "standard": "ГОСТ 21931-76"
    }
  ]
}